{"$schema":"https://json-schema.org/draft/2020-12/schema","type":"object","required":["published_at","score","coverage_pct","groups","indicators"],"properties":{"published_at":{"type":"string"},"score":{"type":["number","null"],"minimum":-100,"maximum":100},"coverage_pct":{"type":"number","minimum":0,"maximum":100},"groups":{"type":"object"},"history":{"description":"The score recomputed at each of the last 60 month-ends from today's latest-vintage series (not a real-time record); the last point is today's reading at its own date. Added 2026-10-08; optional.","type":"object","required":["dates","score"],"properties":{"dates":{"type":"array","items":{"type":"string"}},"score":{"type":"array","items":{"type":["number","null"]}}}},"indicators":{"type":"array","items":{"type":"object","required":["code","group","direction","as_of","momentum","z"],"properties":{"code":{"type":"string"},"group":{"type":"string"},"direction":{"type":"integer"},"as_of":{"type":"string"},"momentum":{"type":"number"},"z":{"type":"number","minimum":-2.5,"maximum":2.5},"mode":{"type":"string"},"periods":{"type":"integer"}}}}}}
