{
  "published_at": "2026-10-15T17:24:38Z",
  "score": 3.5,
  "coverage_pct": 100.0,
  "groups": {
    "prices": {
      "z": -0.03967999999999998,
      "weight": 25,
      "available": 5,
      "expected": 5,
      "active_weight": 25.0
    },
    "real_economy": {
      "z": -0.14566,
      "weight": 25,
      "available": 5,
      "expected": 5,
      "active_weight": 25.0
    },
    "pipeline": {
      "z": 0.49262500000000004,
      "weight": 20,
      "available": 4,
      "expected": 4,
      "active_weight": 20.0
    },
    "housing": {
      "z": -0.573325,
      "weight": 15,
      "available": 4,
      "expected": 4,
      "active_weight": 15.0
    },
    "money_expectations": {
      "z": 0.6943,
      "weight": 15,
      "available": 3,
      "expected": 3,
      "active_weight": 15.0
    }
  },
  "indicators": [
    {
      "code": "CPIAUCSL",
      "group": "prices",
      "direction": 1,
      "as_of": "2026-09-01",
      "momentum": 1.1216,
      "z": 0.8443
    },
    {
      "code": "CPILFESL",
      "group": "prices",
      "direction": 1,
      "as_of": "2026-09-01",
      "momentum": 0.8424,
      "z": 0.3819
    },
    {
      "code": "PCEPI",
      "group": "prices",
      "direction": 1,
      "as_of": "2026-08-01",
      "momentum": 0.2575,
      "z": -1.1111
    },
    {
      "code": "PPIACO",
      "group": "prices",
      "direction": 1,
      "as_of": "2026-08-01",
      "momentum": -0.7829,
      "z": -0.633
    },
    {
      "code": "T5YIE",
      "group": "prices",
      "direction": 1,
      "mode": "diff",
      "periods": 63,
      "as_of": "2026-10-14",
      "momentum": 0.11,
      "z": 0.3195
    },
    {
      "code": "PAYEMS",
      "group": "real_economy",
      "direction": 1,
      "as_of": "2026-09-01",
      "momentum": 0.0957,
      "z": -1.0034
    },
    {
      "code": "UNRATE",
      "group": "real_economy",
      "direction": -1,
      "mode": "diff",
      "as_of": "2026-09-01",
      "momentum": 0.0,
      "z": -0.6745
    },
    {
      "code": "INDPRO",
      "group": "real_economy",
      "direction": 1,
      "as_of": "2026-08-01",
      "momentum": 0.4176,
      "z": 0.3526
    },
    {
      "code": "RSAFS",
      "group": "real_economy",
      "direction": 1,
      "as_of": "2026-09-01",
      "momentum": 1.6541,
      "z": 0.59
    },
    {
      "code": "DSPIC96",
      "group": "real_economy",
      "direction": 1,
      "as_of": "2026-08-01",
      "momentum": 0.6434,
      "z": 0.007
    },
    {
      "code": "ICSA",
      "group": "pipeline",
      "direction": -1,
      "periods": 13,
      "as_of": "2026-10-10",
      "momentum": -4.7847,
      "z": 0.3013
    },
    {
      "code": "CCSA",
      "group": "pipeline",
      "direction": -1,
      "periods": 13,
      "as_of": "2026-10-03",
      "momentum": -4.8943,
      "z": 0.5824
    },
    {
      "code": "PCUOMFGOMFG",
      "group": "pipeline",
      "direction": 1,
      "as_of": "2026-09-01",
      "momentum": 3.9839,
      "z": 1.4915
    },
    {
      "code": "FEDFUNDS",
      "group": "pipeline",
      "direction": -1,
      "mode": "diff",
      "as_of": "2026-09-01",
      "momentum": 0.12,
      "z": -0.4047
    },
    {
      "code": "HOUST",
      "group": "housing",
      "direction": 1,
      "as_of": "2026-08-01",
      "momentum": 7.868,
      "z": 0.7354
    },
    {
      "code": "PERMIT",
      "group": "housing",
      "direction": 1,
      "as_of": "2026-08-01",
      "momentum": -0.4965,
      "z": -0.0922
    },
    {
      "code": "CSUSHPISA",
      "group": "housing",
      "direction": 1,
      "as_of": "2026-07-01",
      "momentum": 0.5382,
      "z": -0.6432
    },
    {
      "code": "pmms_30yr",
      "group": "housing",
      "direction": -1,
      "mode": "diff",
      "periods": 13,
      "as_of": "2026-10-15",
      "momentum": 0.85,
      "z": -2.2933
    },
    {
      "code": "M2SL",
      "group": "money_expectations",
      "direction": 1,
      "as_of": "2026-08-01",
      "momentum": 1.43,
      "z": 0.4259
    },
    {
      "code": "UMCSENT",
      "group": "money_expectations",
      "direction": 1,
      "as_of": "2026-08-01",
      "momentum": 15.4018,
      "z": 1.7835
    },
    {
      "code": "T10Y2Y",
      "group": "money_expectations",
      "direction": 1,
      "mode": "diff",
      "periods": 63,
      "as_of": "2026-10-14",
      "momentum": -0.05,
      "z": -0.1265
    }
  ],
  "history": {
    "dates": [
      "2021-11-30",
      "2021-12-31",
      "2022-01-31",
      "2022-02-28",
      "2022-03-31",
      "2022-04-30",
      "2022-05-31",
      "2022-06-30",
      "2022-07-31",
      "2022-08-31",
      "2022-09-30",
      "2022-10-31",
      "2022-11-30",
      "2022-12-31",
      "2023-01-31",
      "2023-02-28",
      "2023-03-31",
      "2023-04-30",
      "2023-05-31",
      "2023-06-30",
      "2023-07-31",
      "2023-08-31",
      "2023-09-30",
      "2023-10-31",
      "2023-11-30",
      "2023-12-31",
      "2024-01-31",
      "2024-02-29",
      "2024-03-31",
      "2024-04-30",
      "2024-05-31",
      "2024-06-30",
      "2024-07-31",
      "2024-08-31",
      "2024-09-30",
      "2024-10-31",
      "2024-11-30",
      "2024-12-31",
      "2025-01-31",
      "2025-02-28",
      "2025-03-31",
      "2025-04-30",
      "2025-05-31",
      "2025-06-30",
      "2025-07-31",
      "2025-08-31",
      "2025-09-30",
      "2025-10-31",
      "2025-11-30",
      "2025-12-31",
      "2026-01-31",
      "2026-02-28",
      "2026-03-31",
      "2026-04-30",
      "2026-05-31",
      "2026-06-30",
      "2026-07-31",
      "2026-08-31",
      "2026-09-30",
      "2026-10-15"
    ],
    "score": [
      53.0,
      51.9,
      29.8,
      23.1,
      27.0,
      36.0,
      17.2,
      1.6,
      -15.5,
      -24.1,
      -27.3,
      -12.4,
      -32.8,
      -38.5,
      -18.4,
      -2.7,
      -0.9,
      -16.9,
      -26.2,
      -22.2,
      -13.2,
      -6.2,
      7.9,
      -11.4,
      -8.4,
      -12.3,
      -3.2,
      5.0,
      3.0,
      -0.8,
      -19.0,
      -26.9,
      -33.0,
      -16.0,
      -5.4,
      6.2,
      0.2,
      11.8,
      9.8,
      2.9,
      -11.5,
      -18.2,
      -32.2,
      -15.9,
      -6.5,
      3.6,
      -6.6,
      -19.9,
      -15.8,
      -6.7,
      3.0,
      12.8,
      18.7,
      21.6,
      11.8,
      -3.3,
      -12.2,
      -7.2,
      7.8,
      3.5
    ]
  }
}
